Question,Answer,Tags
What are the main characteristics of the Romantic Era in music?,"The Romantic Era prioritized emotional expression, individualism, and nationalism over the formal constraints of the Classical period, marked by an unprecedented expansion in the scope, scale, and emotional range of classical music.","Romantic Era, Music, Characteristics"
How did Romanticism react against the Enlightenment and the Industrial Revolution?,"Romanticism emerged as a reaction against the rationalism of the Enlightenment and the Industrial Revolution, with composers seeking to express intense personal emotions and explore supernatural themes.","Romanticism, Emotion, Historical Context"
What significant changes occurred in symphonic composition during the Romantic period?,"The symphony underwent radical transformation with Beethoven's Ninth Symphony setting new standards, followed by composers like Berlioz, Mahler, and Bruckner creating large-scale symphonic works in length and orchestral forces.","Symphony, Beethoven, Romantic Period"
What is the significance of Richard Wagner's concept of Gesamtkunstwerk in the Romantic Era?,"Wagner's concept of Gesamtkunstwerk (total artwork) revolutionized opera by combining music, drama, poetry, and visual arts, and introduced leitmotifs which influenced not only opera but also symphonic composition and film music.","Richard Wagner, Opera, Music Drama"
What role did nationalism play in the music of the Romantic period?,"National schools of composition emerged as countries sought to express their cultural identity, with composers like Tchaikovsky and Dvořák incorporating folk melodies and national themes into their music.","Nationalism, Romantic Music, Cultural Identity"
